{
  "edges": [],
  "files": [
    {
      "bytes": 3935,
      "id": "file:.github/workflows/deploy-pages.yml",
      "language": "yaml",
      "lines": 106,
      "path": ".github/workflows/deploy-pages.yml",
      "sha256": "049991bbdd5f2392a57743549312512869a6753e213d996cd4377afc0ad5807e",
      "summary": {}
    },
    {
      "bytes": 7915,
      "id": "file:404.html",
      "language": "html",
      "lines": 122,
      "path": "404.html",
      "sha256": "9b46abeb57d2e297f0495934570dd8d17e0aa0e68e48954fa2f3219d4d3ae387",
      "summary": {
        "elements": [
          "reader-panel"
        ],
        "title": "Not found — secrets.sgit.ai"
      }
    },
    {
      "bytes": 2193,
      "id": "file:admin/build/assemble_site.py",
      "language": "python",
      "lines": 49,
      "module": "module:admin/build/assemble_site.py",
      "path": "admin/build/assemble_site.py",
      "sha256": "560c312956e540d3e48ff13df69cc1173df5ffbed59f0cd1a7b1a1711e7be31f",
      "summary": {
        "classes": 1,
        "doc": "secrets.sgit.ai — Assemble__Site\nCopies the deployable tree into _site/ for the Pages artifact: everything\nexcept .git, .github, infra, tests/unit and node_modules (section 9.1 of the\nbrief). The exclude list lives here and nowhere else; the deploy job calls\nthis file so the same tree can be assembled and inspected locally.\nUsage: python3 admin/build/assemble_site.py [--out _site]",
        "functions": 0
      }
    },
    {
      "bytes": 20007,
      "id": "file:admin/build/chrome.py",
      "language": "python",
      "lines": 226,
      "module": "module:admin/build/chrome.py",
      "path": "admin/build/chrome.py",
      "sha256": "ae75a0a6a4de89374a66597a1755797b28d45fa158c41cf50b512ba3554ee8b8",
      "summary": {
        "classes": 1,
        "doc": "secrets.sgit.ai — Chrome\nThe one definition of the site chrome: head block, the family nav (grouped\nmenus with dropdowns, the parent link, the stage pill, the version badge,\nthe phone menu button), breadcrumbs, footer, CSP and canonical URL. Every\nHTML page gets it injected between markers by gen_chrome.py, so the chrome\ncannot drift between pages. The nav shape is the one sgit.ai, nfrs.sgit.ai\nand pki.sgit.ai run; the interaction lives in assets/nav.js. The theme picker\nin the nav is generated from data/themes.json; assets/theme.js applies the\nchoice and assets/themes.css holds every colour, ",
        "functions": 0
      }
    },
    {
      "bytes": 3492,
      "id": "file:admin/build/gate.py",
      "language": "python",
      "lines": 55,
      "module": "module:admin/build/gate.py",
      "path": "admin/build/gate.py",
      "sha256": "33a4b24abee7b6bf827ed2ff8acc3e14534ad49dbc708c5616a8af6e784bfd4c",
      "summary": {
        "classes": 1,
        "doc": "secrets.sgit.ai — Gate\nThe release gate, one command, identical locally and in CI. The CI validate\njob runs exactly this file, so a release that fails here fails the same way\nthere. Order matters: the generators run before the gate reads their output.\nUsage: python3 admin/build/gate.py            check everything (what CI does)\npython3 admin/build/gate.py --build    regenerate, then check everything",
        "functions": 0
      }
    },
    {
      "bytes": 2425,
      "id": "file:admin/build/gen_chrome.py",
      "language": "python",
      "lines": 49,
      "module": "module:admin/build/gen_chrome.py",
      "path": "admin/build/gen_chrome.py",
      "sha256": "702aec56f2c9d2e87b138e944e07d6c66f60b459519c545e913ef75bfa9189fe",
      "summary": {
        "classes": 1,
        "doc": "secrets.sgit.ai — Gen__Chrome\nInjects the chrome (head block, nav, footer) into every HTML page between the\nsg-secrets markers. `--check` fails when any page is not current.\nUsage: python3 admin/build/gen_chrome.py [--check]",
        "functions": 0
      }
    },
    {
      "bytes": 11992,
      "id": "file:admin/build/gen_docs.py",
      "language": "python",
      "lines": 170,
      "module": "module:admin/build/gen_docs.py",
      "path": "admin/build/gen_docs.py",
      "sha256": "698761ae15847e90ccbb88367274f78b408fa1ce549b30d9c995b494a1126984",
      "summary": {
        "classes": 1,
        "doc": "secrets.sgit.ai — Gen__Docs\nRenders every markdown document under docs/ to an HTML page beside it\n(docs/design/x.md -> docs/design/x.html) and writes an index page per\nfolder. The markdown stays the source and the twin; the HTML page names it\nin <meta name=\"sg-secrets:source\">. Runs before gen_chrome, which fills the\nchrome; only the document block and the head metas are this generator's.\nUsage: python3 admin/build/gen_docs.py [--check]",
        "functions": 0
      }
    },
    {
      "bytes": 11271,
      "id": "file:admin/build/gen_features.py",
      "language": "python",
      "lines": 178,
      "module": "module:admin/build/gen_features.py",
      "path": "admin/build/gen_features.py",
      "sha256": "63bc6861ed19d7b228822d7b1dd7f9225a1c7f113c5b68fcc0839f73649312f0",
      "summary": {
        "classes": 1,
        "doc": "secrets.sgit.ai — Gen__Features\nReads data/features.json, validates it, and generates (1) docs/reality.md, the\nlist of what is built, and (2) the status tables in pages that carry a\n<!-- sg-secrets:features:start area=\"...\" --> block. `--check` fails on drift.\nUsage: python3 admin/build/gen_features.py [--check]",
        "functions": 0
      }
    },
    {
      "bytes": 7194,
      "id": "file:admin/build/gen_llms.py",
      "language": "python",
      "lines": 118,
      "module": "module:admin/build/gen_llms.py",
      "path": "admin/build/gen_llms.py",
      "sha256": "9964a8d3d69c884b142ec26e5de2d4fad1dab137ae98609159cd30e7f416d930",
      "summary": {
        "classes": 1,
        "doc": "secrets.sgit.ai — Gen__Llms\nGenerates the machine indexes: llms.txt (every page and document, one line\neach), llms-full.txt (every page twin and every document concatenated) and\nsitemap.xml. Runs after gen_twins.\nUsage: python3 admin/build/gen_llms.py [--check]",
        "functions": 0
      }
    },
    {
      "bytes": 3958,
      "id": "file:admin/build/gen_search.py",
      "language": "python",
      "lines": 79,
      "module": "module:admin/build/gen_search.py",
      "path": "admin/build/gen_search.py",
      "sha256": "c95b637874318ad5a0839625693482f95195299b393261dceb04564408cbf050",
      "summary": {
        "classes": 1,
        "doc": "secrets.sgit.ai — Gen__Search\nWrites data/search-index.json: one entry per page and per rendered document\n(url, twin, title, description, headings, the text), from the markdown twins\ngen_twins wrote. The reader's column searches it offline (tier 0) and the\nchat's search tool reads it (tier 1); nothing leaves the browser for a search.\nUsage: python3 admin/build/gen_search.py [--check]",
        "functions": 0
      }
    },
    {
      "bytes": 4933,
      "id": "file:admin/build/gen_twins.py",
      "language": "python",
      "lines": 75,
      "module": "module:admin/build/gen_twins.py",
      "path": "admin/build/gen_twins.py",
      "sha256": "970b3654f1e836ffd9a55f7446e8a001bb5f9e8502859041e135eff34067b450",
      "summary": {
        "classes": 1,
        "doc": "secrets.sgit.ai — Gen__Twins\nWrites the markdown twin of every HTML page (index.html -> index.md) from the\npage's <main>, with a header that names the source and the site version.\nUsage: python3 admin/build/gen_twins.py [--check]",
        "functions": 0
      }
    },
    {
      "bytes": 6673,
      "id": "file:admin/build/gen_versions.py",
      "language": "python",
      "lines": 112,
      "module": "module:admin/build/gen_versions.py",
      "path": "admin/build/gen_versions.py",
      "sha256": "5636c992e1203d293e429799c8137badd74425e8bbdfd7e0cefc39cc4c33a311",
      "summary": {
        "classes": 1,
        "doc": "secrets.sgit.ai — Gen__Versions\nRenders the release history table in admin/versions.html from\ndata/versions.json, and checks the file agrees with version.txt.\nUsage: python3 admin/build/gen_versions.py [--check]",
        "functions": 0
      }
    },
    {
      "bytes": 7848,
      "id": "file:admin/build/html_to_md.py",
      "language": "python",
      "lines": 210,
      "module": "module:admin/build/html_to_md.py",
      "path": "admin/build/html_to_md.py",
      "sha256": "5ea5f75c049c8b75981b62a598939cb478f92b2ee333244e220824b78c56ee2c",
      "summary": {
        "classes": 1,
        "doc": "secrets.sgit.ai — Html__To__Markdown\nConverts the <main> of a page into its markdown twin. Handles the elements the\nsite uses (headings, paragraphs, lists, tables, links, code, emphasis) and\nrewrites internal .html links to their .md twins so an agent never parses HTML.",
        "functions": 0
      }
    },
    {
      "bytes": 9841,
      "id": "file:admin/build/md_to_html.py",
      "language": "python",
      "lines": 191,
      "module": "module:admin/build/md_to_html.py",
      "path": "admin/build/md_to_html.py",
      "sha256": "97841987ebdf3aec4b7cf19fc9b0ee8a66139f34a6753e361ba139dd969e1a33",
      "summary": {
        "classes": 1,
        "doc": "secrets.sgit.ai — Markdown__To__Html\nRenders the markdown the site carries (the design documents, the ops notes,\nreality.md) to an HTML fragment: headings with GitHub-style ids, paragraphs,\nnested lists, task lists, tables, fenced code, blockquotes, rules, links,\nimages, emphasis and inline code. Standard library only; no extensions.",
        "functions": 0
      }
    },
    {
      "bytes": 4915,
      "id": "file:admin/build/pages.py",
      "language": "python",
      "lines": 94,
      "module": "module:admin/build/pages.py",
      "path": "admin/build/pages.py",
      "sha256": "cf7005fd5ace37c3ead23a6c8d00b5bc3bc9718a16a686e5c70a36bbca1a9591",
      "summary": {
        "classes": 1,